{
  "$schema": "../../schemas/pay-jobs.schema.json",
  "version": "1.0.0",
  "generatedAt": "2026-08-28",
  "disclaimer": {
    "en": "Reference only; verify with the official gazette/order or your DDO.",
    "hi": "केवल संदर्भ हेतु; आधिकारिक राजपत्र/आदेश अथवा अपने डीडीओ से पुष्टि करें।"
  },
  "organisations": {
    "ib": {
      "name": {
        "en": "Intelligence Bureau",
        "hi": "आसूचना ब्यूरो"
      },
      "ministry": {
        "en": "Ministry of Home Affairs",
        "hi": "गृह मंत्रालय"
      }
    },
    "cbi": {
      "name": {
        "en": "Central Bureau of Investigation",
        "hi": "केंद्रीय अन्वेषण ब्यूरो"
      },
      "ministry": {
        "en": "Department of Personnel and Training",
        "hi": "कार्मिक एवं प्रशिक्षण विभाग"
      }
    },
    "capf": {
      "name": {
        "en": "Central Armed Police Forces — BSF, CRPF, CISF, ITBP, SSB",
        "hi": "केंद्रीय सशस्त्र पुलिस बल — सीमा सुरक्षा बल, केंद्रीय रिज़र्व पुलिस बल, केंद्रीय औद्योगिक सुरक्षा बल, भारत-तिब्बत सीमा पुलिस, सशस्त्र सीमा बल"
      },
      "ministry": {
        "en": "Ministry of Home Affairs",
        "hi": "गृह मंत्रालय"
      }
    },
    "delhi-police": {
      "name": {
        "en": "Delhi Police",
        "hi": "दिल्ली पुलिस"
      },
      "ministry": {
        "en": "Ministry of Home Affairs",
        "hi": "गृह मंत्रालय"
      }
    },
    "css": {
      "name": {
        "en": "Central Secretariat Service",
        "hi": "केंद्रीय सचिवालय सेवा"
      },
      "ministry": {
        "en": "Department of Personnel and Training",
        "hi": "कार्मिक एवं प्रशिक्षण विभाग"
      }
    },
    "cbdt": {
      "name": {
        "en": "Income Tax Department",
        "hi": "आयकर विभाग"
      },
      "ministry": {
        "en": "Central Board of Direct Taxes, Department of Revenue",
        "hi": "केंद्रीय प्रत्यक्ष कर बोर्ड, राजस्व विभाग"
      }
    },
    "cbic": {
      "name": {
        "en": "Customs, GST and Central Excise formations",
        "hi": "सीमा शुल्क, जीएसटी तथा केंद्रीय उत्पाद शुल्क संरचनाएँ"
      },
      "ministry": {
        "en": "Central Board of Indirect Taxes and Customs, Department of Revenue",
        "hi": "केंद्रीय अप्रत्यक्ष कर एवं सीमा शुल्क बोर्ड, राजस्व विभाग"
      }
    },
    "ed": {
      "name": {
        "en": "Directorate of Enforcement",
        "hi": "प्रवर्तन निदेशालय"
      },
      "ministry": {
        "en": "Department of Revenue",
        "hi": "राजस्व विभाग"
      }
    },
    "cag": {
      "name": {
        "en": "Indian Audit and Accounts Department",
        "hi": "भारतीय लेखापरीक्षा एवं लेखा विभाग"
      },
      "ministry": {
        "en": "Comptroller and Auditor General of India",
        "hi": "भारत के नियंत्रक एवं महालेखापरीक्षक"
      }
    },
    "cga": {
      "name": {
        "en": "Central civil accounts and defence accounts organisations",
        "hi": "केंद्रीय सिविल लेखा तथा रक्षा लेखा संगठन"
      },
      "ministry": {
        "en": "Controller General of Accounts, Ministry of Finance",
        "hi": "महालेखा नियंत्रक, वित्त मंत्रालय"
      }
    },
    "mospi": {
      "name": {
        "en": "Indian Statistical Service and subordinate statistical service",
        "hi": "भारतीय सांख्यिकी सेवा तथा अधीनस्थ सांख्यिकी सेवा"
      },
      "ministry": {
        "en": "Ministry of Statistics and Programme Implementation",
        "hi": "सांख्यिकी एवं कार्यक्रम कार्यान्वयन मंत्रालय"
      }
    },
    "ncb": {
      "name": {
        "en": "Narcotics Control Bureau",
        "hi": "स्वापक नियंत्रण ब्यूरो"
      },
      "ministry": {
        "en": "Ministry of Home Affairs",
        "hi": "गृह मंत्रालय"
      }
    },
    "nia": {
      "name": {
        "en": "National Investigation Agency",
        "hi": "राष्ट्रीय अन्वेषण अभिकरण"
      },
      "ministry": {
        "en": "Ministry of Home Affairs",
        "hi": "गृह मंत्रालय"
      }
    },
    "posts": {
      "name": {
        "en": "Department of Posts",
        "hi": "डाक विभाग"
      },
      "ministry": {
        "en": "Ministry of Communications",
        "hi": "संचार मंत्रालय"
      }
    },
    "railways": {
      "name": {
        "en": "Indian Railways",
        "hi": "भारतीय रेल"
      },
      "ministry": {
        "en": "Ministry of Railways",
        "hi": "रेल मंत्रालय"
      }
    },
    "aisc": {
      "name": {
        "en": "All India Services and Central Civil Services",
        "hi": "अखिल भारतीय सेवाएँ तथा केंद्रीय सिविल सेवाएँ"
      },
      "ministry": {
        "en": "Government of India",
        "hi": "भारत सरकार"
      }
    },
    "kvs": {
      "name": {
        "en": "Kendriya Vidyalaya Sangathan",
        "hi": "केंद्रीय विद्यालय संगठन"
      },
      "ministry": {
        "en": "Ministry of Education",
        "hi": "शिक्षा मंत्रालय"
      }
    },
    "nvs": {
      "name": {
        "en": "Navodaya Vidyalaya Samiti",
        "hi": "नवोदय विद्यालय समिति"
      },
      "ministry": {
        "en": "Ministry of Education",
        "hi": "शिक्षा मंत्रालय"
      }
    },
    "isro": {
      "name": {
        "en": "Indian Space Research Organisation",
        "hi": "भारतीय अंतरिक्ष अनुसंधान संगठन"
      },
      "ministry": {
        "en": "Department of Space",
        "hi": "अंतरिक्ष विभाग"
      }
    },
    "drdo": {
      "name": {
        "en": "Defence Research and Development Organisation",
        "hi": "रक्षा अनुसंधान एवं विकास संगठन"
      },
      "ministry": {
        "en": "Ministry of Defence",
        "hi": "रक्षा मंत्रालय"
      }
    },
    "epfo": {
      "name": {
        "en": "Employees' Provident Fund Organisation",
        "hi": "कर्मचारी भविष्य निधि संगठन"
      },
      "ministry": {
        "en": "Ministry of Labour and Employment",
        "hi": "श्रम एवं रोज़गार मंत्रालय"
      }
    },
    "mod-civ": {
      "name": {
        "en": "Defence civilian establishments",
        "hi": "रक्षा असैनिक स्थापनाएँ"
      },
      "ministry": {
        "en": "Ministry of Defence",
        "hi": "रक्षा मंत्रालय"
      }
    },
    "ordnance": {
      "name": {
        "en": "Ordnance factories and defence production undertakings",
        "hi": "आयुध निर्माणियाँ तथा रक्षा उत्पादन उपक्रम"
      },
      "ministry": {
        "en": "Department of Defence Production, Ministry of Defence",
        "hi": "रक्षा उत्पादन विभाग, रक्षा मंत्रालय"
      }
    }
  },
  "exams": {
    "ib-acio": {
      "name": {
        "en": "Intelligence Bureau ACIO Grade-II/Executive Examination",
        "hi": "आसूचना ब्यूरो सहायक केंद्रीय आसूचना अधिकारी ग्रेड-II/कार्यपालक परीक्षा"
      },
      "authority": {
        "en": "Ministry of Home Affairs",
        "hi": "गृह मंत्रालय"
      },
      "url": "https://www.mha.gov.in/"
    },
    "ib-sa": {
      "name": {
        "en": "Intelligence Bureau Security Assistant / Multi Tasking Staff Examination",
        "hi": "आसूचना ब्यूरो सुरक्षा सहायक / बहु कार्य कर्मचारी परीक्षा"
      },
      "authority": {
        "en": "Ministry of Home Affairs",
        "hi": "गृह मंत्रालय"
      },
      "url": "https://www.mha.gov.in/"
    },
    "ssc-cgl": {
      "name": {
        "en": "Combined Graduate Level Examination",
        "hi": "संयुक्त स्नातक स्तरीय परीक्षा"
      },
      "authority": {
        "en": "Staff Selection Commission",
        "hi": "कर्मचारी चयन आयोग"
      },
      "url": "https://ssc.gov.in/"
    },
    "ssc-chsl": {
      "name": {
        "en": "Combined Higher Secondary Level (10+2) Examination",
        "hi": "संयुक्त उच्चतर माध्यमिक (10+2) स्तरीय परीक्षा"
      },
      "authority": {
        "en": "Staff Selection Commission",
        "hi": "कर्मचारी चयन आयोग"
      },
      "url": "https://ssc.gov.in/"
    },
    "ssc-mts": {
      "name": {
        "en": "Multi Tasking (Non-Technical) Staff and Havaldar Examination",
        "hi": "बहु कार्य (अ-तकनीकी) कर्मचारी तथा हवलदार परीक्षा"
      },
      "authority": {
        "en": "Staff Selection Commission",
        "hi": "कर्मचारी चयन आयोग"
      },
      "url": "https://ssc.gov.in/"
    },
    "ssc-gd": {
      "name": {
        "en": "Constable (General Duty) Examination",
        "hi": "आरक्षक (सामान्य ड्यूटी) परीक्षा"
      },
      "authority": {
        "en": "Staff Selection Commission",
        "hi": "कर्मचारी चयन आयोग"
      },
      "url": "https://ssc.gov.in/"
    },
    "ssc-cpo": {
      "name": {
        "en": "Sub-Inspector in Delhi Police and Central Armed Police Forces Examination",
        "hi": "दिल्ली पुलिस तथा केंद्रीय सशस्त्र पुलिस बलों में उप निरीक्षक परीक्षा"
      },
      "authority": {
        "en": "Staff Selection Commission",
        "hi": "कर्मचारी चयन आयोग"
      },
      "url": "https://ssc.gov.in/"
    },
    "ssc-je": {
      "name": {
        "en": "Junior Engineer (Civil, Mechanical, Electrical and Quantity Surveying and Contracts) Examination",
        "hi": "कनिष्ठ अभियंता (सिविल, यांत्रिक, विद्युत तथा परिमाण सर्वेक्षण एवं संविदा) परीक्षा"
      },
      "authority": {
        "en": "Staff Selection Commission",
        "hi": "कर्मचारी चयन आयोग"
      },
      "url": "https://ssc.gov.in/"
    },
    "ssc-steno": {
      "name": {
        "en": "Stenographer Grade C and D Examination",
        "hi": "आशुलिपिक ग्रेड सी तथा डी परीक्षा"
      },
      "authority": {
        "en": "Staff Selection Commission",
        "hi": "कर्मचारी चयन आयोग"
      },
      "url": "https://ssc.gov.in/"
    },
    "ssc-delhi-police-constable": {
      "name": {
        "en": "Delhi Police Constable (Executive) Examination",
        "hi": "दिल्ली पुलिस आरक्षक (कार्यपालक) परीक्षा"
      },
      "authority": {
        "en": "Staff Selection Commission",
        "hi": "कर्मचारी चयन आयोग"
      },
      "url": "https://ssc.gov.in/"
    },
    "upsc-cse": {
      "name": {
        "en": "Civil Services Examination",
        "hi": "सिविल सेवा परीक्षा"
      },
      "authority": {
        "en": "Union Public Service Commission",
        "hi": "संघ लोक सेवा आयोग"
      },
      "url": "https://upsc.gov.in/"
    },